<?xml version="1.0" encoding="GB2312"?>

<shiporder orderid="889923"
xmlns:xsi="http://www.w3.org/2001/XMLSchema-instance"
xsi:noNamespaceSchemaLocation="shiporder.xsd">
 <orderperson>George Bush</orderperson>
 <shipto>
  <name>Íõº£Éú</name>
  <address>Oxford Street</address>
  <city>London</city>
  <country>UK</country>
  <ValueDate>19990131T120359</ValueDate>
 </shipto>
 <item>
  <title>Empire Burlesque</title>
  <note>Special Edition</note>
  <quantity>1</quantity>
  <price>10.90</price>
 </item>
 <item>
  <title>Hide your heart</title>
  <quantity>1</quantity>
  <price>9.90</price>
 </item>
</shiporder>
